{"approval_ready":true,"audit_id":"05f2d9fd8bdd1e480d490eea6587ca3daf2ab7334b67b44f1733a2d88fa1a60b","authority_statement":"Maverick retains final approval and mission-completion authority.","canary":"CANOPY-7C2F-ATLAS","dispositions":[{"correction_evidence":["src/wingman/core/ledger/database.py:139-147 rejects maintenance unless the managed connection was opened with an exclusive lock from the outset.","src/wingman/core/ledger/locking.py:125-178 now supports acquisition and release only; the public in-place conversion method was removed.","tests/wingman/test_ledger_transition.py:708-771 runs two spawned shared maintenance callers in both release orders and proves each rejection retains an open shared lock."],"disposition":"resolved","finding_id":"CC-0001","summary":"Removed shared-to-exclusive lock conversion and made every migration caller acquire exclusive ownership when opening its connection.","validation_results":["Transition safety: 25 passed in 8.657 seconds.","Exact focused regression command: 146 passed in 10.068 seconds.","Complete eligible suite: 329 passed in 40.258 seconds.","Five Draft 2020-12 schemas, 192 in-memory Python compilations, governance validation, changed-scope Ruff, and Git whitespace validation passed.","The first 123-test caller regression run had two test-fixture lock-timeout errors; the identical rerun passed all 123 tests in 1.090 seconds after the setup-only exclusive connection was closed before shared use."]}],"envelope_id":"fccfeff8387a1e9f053a8fadc68ae625f4cce6789db4b12a0395ec45c2b37795","generated_at":"2026-08-10T19:54:50Z","package_hash":"837f9b2485f367343e1985e05317fc609dbf695f2a59d191abaaa4b070c619dd","reconciliation_complete":true,"report_hash":"4e71b05e9e93111499d4edb7410fa484c0ae251fcf4e5b6c1b7cbf7ffbf0c2ae","schema_version":"1.0"}
