{"approval_ready":true,"audit_id":"6396de29749f52ea9cd4b95b03f75bc35894c9dc1d520809c49633b61492d46c","authority_statement":"Maverick retains final approval and mission-completion authority.","canary":"CANOPY-7C2F-ATLAS","dispositions":[],"envelope_id":"09eb6eed68d95f32e530561cf8604f8c1e297e4ad7cb16d04ae0b7003e8df12a","generated_at":"2026-08-10T20:03:56Z","package_hash":"22034cbc6ff276de08eaaa1e51a6c1e3d0066df70f26e34d3ff6815240ea2eef","reconciliation_complete":true,"report_hash":"93fe6c2e0c2e0739defabdcecd23e2ce879697369e93cbbbe75c4ee3f4620b98","schema_version":"1.0"}
